{"Patient":{"FName":"Monika","LName":"Wegmüller","BDt":"1943-05-15","Gender":2,"Street":"Wiesenstr. 12","Zip":"8003","City":"Zürich"},"Medicaments":[{"Id":"7680500440334","IdType":2,"Pos":[{"D":[1,0,1,0]}],"Unit":"STK","AppInstr":"-","Rep":3,"Subs":0}],"MedType":3,"Id":"1c5b5e9b-24f7-45ed-ae9c-6e2ec53e7b05","Auth":"7601000234438","Dt":"2012-02-04T14:00:00+01:00","Rmk":"Kommentar zu Medication Prescription","rev":3,"HcPerson":{"Gln":"7601000234438","FName":"Familien","LName":"Hausarzt"},"HcOrg":{"Name":"Hausarzt","Street":"Krankenstrasse 2","Zip":"8005","City":"Zürich","Country":"CH"}}