{"Patient":{"FName":"Hans","LName":"Muster","BDt":"1950-03-21","Gender":1,"Street":"Testweg 1","Zip":"3000","City":"Bern","Phone":"+41 31 000 00 00","Rcv":"7601000000099","Ids":[{"Type":1,"Val":"80756000000000000001"}]},"Medicaments":[{"Id":"7680521101306","IdType":2,"Pos":[{"DtTo":"2026-12-31","D":[1,0,0.5,0]}],"Unit":"STK","AppInstr":"Mit Wasser einnehmen","Rep":3,"Subs":1,"NbPack":2,"IndC":"12345.01"},{"Id":"Eigenes Praeparat","IdType":1,"Subs":0}],"MedType":3,"Id":"7b1f3c1e-9d54-4a0e-8e0c-2a6c1f9e8d02","Auth":"7601000000001","Zsr":"H123456","Dt":"2026-10-01T09:30:00+02:00","Rmk":"Bitte Beratung durch die Apotheke","rev":3,"HcPerson":{"Gln":"7601000000001","FName":"Thea","LName":"Test"},"HcOrg":{"Name":"Praxis Test","NameAffix":"Allgemeine Innere Medizin","Street":"Testgasse 1","Zip":"3000","City":"Bern","Zsr":"H123456","Phone":"+41 31 111 11 11","Email":"praxis@example.org"}}